Product ID,SKU,Display Name
4526,IS100-01,Italian black braces
4527,IS100-02,Italian brown braces
6893,IS100-03,Italian braces Vivace
4528,IS100-04,Dark blue dotted Italian braces
4529,IS100-05,Italian navy braces Music
4530,IS100-06,Italian navy braces
4531,IS100-07,Navy dotted Italian braces
4532,IS100-08,Dark green dotted Italian braces
6894,IS100-10,Italian black braces Moose
4533,IS100-11,Italian light pink braces
6895,IS100-14,Italian orange braces
4534,IS100-15,Striped Italian braces navy & burgundy
4535,IS100-16,Italian grey braces
6896,IS100-17,Italian forest green braces Deer
6897,IS100-18,Italian forest green braces Wild boar
4536,IS100-19,Italian braces Hunter
6898,IS100-20,Italian braces Exotic animals
6899,IS100-21,Italian braces Fiorentina
6900,IS100-22,Italian braces Fisherman
6901,IS100-23,Italian braces Tropical Vibes
6902,IS100-24,Italian braces Flamingo
6903,IS100-25,Italian dark blue braces paisley
6904,IS100-26,Italian burgundy braces paisley
6905,IS100-27,Italian dark green braces paisley
6906,IS100-28,Italian beige braces paisley
6907,IS100-29,Italian black braces paisley
6908,IS100-30,Italian olive green braces
4537,IS100-34,Italian dark beige braces
4538,IS100-35,Italian braces Germany
4539,IS100-36,Braces Pride-festival
6909,IS100-37,Italian braces Trento
6910,IS100-38,Italian beige braces
6911,IS100-39,Italian grey braces Vivaldi
6912,IS100-40,Italian black braces Diamond
6913,IS100-41,Italian navy braces Diamond
6914,IS100-42,Italian beige braces Diamond
6915,IS100-43,Italian braces Bella Blue
4540,IS200-01,Italian black braces
6916,IS200-02,Italian grey skinny braces
6917,IS200-03,Italian burgundy skinny braces
6918,IS200-04,Italian brown skinny braces
4541,ISB100-01,Italian black braces with button fastening
6919,ISB200-01,Italian black skinny braces with button fastening
4542,ISL100-01,Italian black braces Premium
4543,ISS200-01,Italian black skinny braces Satin
5859,PA200-18,Skinny burgundy dotted braces
5978,S200-04,Burgundy skinny braces
5979,S200-09,Navy skinny braces
5980,S200-15,Black skinny braces
5981,s200-17,Dark green skinny braces
5985,S400-09,Navy braces with button fastening
5987,S400-17,Dark green braces with button fastening
7076,S600-15,Black kids braces 2-13 years
5994,S600-16,Lime green kids braces 2-13 years
5996,S600-23,Mint green kids braces 2-13 years
5999,S700-15,Black braces All Black
6000,S800-15,Black skinny braces All black